{
  "protocol_version": "1.0",
  "handoff_id": "handoff-example-001",
  "task_id": "task-example-001",
  "state": "sealed",
  "source_actor": {
    "actor_id": "agent-example",
    "role": "agent"
  },
  "target_actor": {
    "actor_id": "reviewer-example",
    "role": "reviewer"
  },
  "created_at": "2026-01-01T00:30:00Z",
  "sealed_at": "2026-01-01T00:45:00Z",
  "summary": "Synthetic handoff for public protocol validation.",
  "artifacts": [
    {
      "artifact_id": "artifact-example-001",
      "name": "result.txt",
      "media_type": "text/plain",
      "size_bytes": 12,
      "digest": "sha256:1111111111111111111111111111111111111111111111111111111111111111",
      "uri": "urn:acp:artifact:example-001"
    }
  ],
  "artifact_manifest_hash": "sha256:4bc922e059b0386446c58e48a66bf9f75d47dfe1fd33803578c43867112fed76",
  "test_results": [
    {
      "name": "synthetic-schema-review",
      "status": "unavailable",
      "evidence_digest": "sha256:3333333333333333333333333333333333333333333333333333333333333333"
    }
  ],
  "parameter_binding": {
    "protocol_version": "1.0",
    "task_id": "task-example-001",
    "capability_id": "capability-example-001",
    "workspace_id": "workspace-example-001",
    "workspace_commit": "0123456789abcdef0123456789abcdef01234567",
    "request_id": "request-example-001",
    "approval_id": "approval-example-001",
    "policy_version": "policy-v1",
    "scope_hash": "sha256:284033d6a7a54a8b14f098b1be07da094a4829fa29eefa1735ee2be24ad3f4aa",
    "adapter_profile": "example-local",
    "not_before": "2026-01-01T00:00:00Z",
    "expires_at": "2026-01-01T01:00:00Z"
  },
  "parameter_binding_hash": "sha256:43335140fbd48543e8916e08f50f7a1477aa86c23153e84a210b2a9815f30ab7"
}
